{
  "elements": [
    {
      "detector": "manual-evidence",
      "id": "I-01",
      "reason": "manual-evidence",
      "type": "interface",
      "verdict": "unknown",
      "waived_by": null
    },
    {
      "detector": "declared",
      "id": "I-02",
      "reason": null,
      "type": "interface",
      "verdict": "conformant",
      "waived_by": null
    },
    {
      "detector": "contract",
      "id": "I-03",
      "reason": null,
      "type": "interface",
      "verdict": "conformant",
      "waived_by": null
    },
    {
      "detector": "import",
      "id": "I-04",
      "reason": "unsupported-resolution",
      "type": "interface",
      "verdict": "unknown",
      "waived_by": null
    },
    {
      "detector": "import",
      "id": "ARCH-C1",
      "reason": null,
      "type": "constraint",
      "verdict": "conformant",
      "waived_by": null
    },
    {
      "detector": "manual-evidence",
      "id": "ARCH-C2",
      "reason": "manual-evidence",
      "type": "constraint",
      "verdict": "unknown",
      "waived_by": null
    },
    {
      "detector": "manual-evidence",
      "id": "ARCH-C3",
      "reason": "manual-evidence",
      "type": "constraint",
      "verdict": "unknown",
      "waived_by": null
    },
    {
      "detector": "declared",
      "id": "ARCH-C4",
      "reason": "unsupported-resolution",
      "type": "constraint",
      "verdict": "unknown",
      "waived_by": null
    }
  ],
  "exceptions": [],
  "findings": [
    {
      "class": "manual-obligation",
      "detail": "manual-evidence element: verify by review, restated in every report",
      "element": "ARCH-C2",
      "suppressed_by": null
    },
    {
      "class": "manual-obligation",
      "detail": "manual-evidence element: verify by review, restated in every report",
      "element": "ARCH-C3",
      "suppressed_by": null
    },
    {
      "class": "manual-obligation",
      "detail": "manual-evidence element: verify by review, restated in every report",
      "element": "I-01",
      "suppressed_by": null
    }
  ],
  "generated_at": "2026-09-14T05:48:10Z",
  "manifest": {
    "path": "workstreams/WS-005-gate-verdicts/spec/intended-graph.yaml",
    "project": "steward",
    "sha256": "d6515185074b5d6eb9ac12b88a906f7c3a39f683bd2072a36a78d6ef085a72c9"
  },
  "projects": {
    "dispatcher": {
      "commit": "13d500061f3372adeb3ecfc0d5b653ebda381ff4",
      "dirty": false
    },
    "steward": {
      "commit": "9d5f8e70c1b7f6a7ad5999189c20153162d9c015",
      "dirty": false
    }
  },
  "schema": "conformance-report/v1",
  "snapshot": {
    "complete": true,
    "content_hash": "prograph-snapshot/v1+sha256:69f5c6981cbb997318f15a8743546b82039226281ca22102445b059064f8c093",
    "id": 14,
    "indexed_at": "2026-09-14T05:48:06Z"
  },
  "summary": {
    "findings": {
      "expired-waiver": 0,
      "forbidden-edge": 0,
      "manual-obligation": 3,
      "missing-required-edge": 0,
      "orphan-component": 0,
      "undeclared-edge": 0
    },
    "verdicts": {
      "conformant": 3,
      "unknown": 5,
      "violation": 0
    }
  },
  "system": "ws005-governance-panel",
  "tool": {
    "name": "prograph",
    "schema": "intended-graph/v1",
    "version": "0.1.0"
  }
}
